{
  "schema_version": 2,
  "case_id": "com.example.app-20260829-120000",
  "package": "com.example.app",
  "device_serial": "device-serial",
  "apk": "C:/cases/input/app.apk",
  "dex_zip": "C:/cases/input/runtime-dex.zip",
  "dex_dir": null,
  "dex_inputs": [],
  "profile": "android-arm64-360-dexvmp",
  "config_revision": 1,
  "state": "INIT",
  "execute_device": false,
  "so_dump_config": {
    "jiaguNames": ["libjiagu_a64.so"],
    "manualLoadFunctionOffset": null,
    "exactDumpOffset": null,
    "handleGlobalOffset": null,
    "manualLoaderSignature": null,
    "exactDumpInstructionMask": null,
    "exactDumpInstructionValue": null,
    "soinfoLoadStartOffset": null,
    "soinfoPhdrOffset": null,
    "soinfoLoadSizeOffset": null,
    "soinfoPhnumOffset": null,
    "soinfoDynamicOffset": null,
    "soinfoLoadBiasOffset": null,
    "soinfoNameOffset": null
  },
  "tools": {
    "sofixer": "C:/tools/SoFixer-Windows-64.exe"
  },
  "ida": {
    "adapter": "ida-mcp",
    "root_rva": null,
    "response": "C:/cases/ida/responses/response.json"
  },
  "simulation": {
    "outer": null,
    "linker": null,
    "binary": null,
    "config": null
  },
  "commands": {},
  "artifacts": {},
  "stage_records": {}
}
